video_id,clip_id,text,label,label_t,label_v,label_a,error
video_0001,1,我不想嫁给李茶,-1.0,-1.0,-1.0,-1.0,0.0
video_0043,30,我用了十五年的时间想忘了被人抛弃或者说你可以走了这种感觉,-0.2,-0.8,-0.2,-0.6,0.0
video_0043,32,他是一个电影学院大一第一学期的一个入门表演练习,0.0,0.0,0.0,0.0,0.0
video_0043,34,但对不起，演员是知道的,0.0,-0.2,0.0,0.0,0.0
video_0043,36,我没拿,-1.0,0.0,-1.0,-0.8,0.0
video_0043,47,好久没有体会到这种即兴的魅力，而且我很感谢我对手，真的,1.0,1.0,1.0,0.8,0.0
video_0043,49,来吧，期待你的表演,1.0,0.8,1.0,1.0,0.0
video_0043,58,我只能说我这次是侥幸,1.0,0.4,1.0,0.0,0.0
video_0043,60,他非常有类型化，他摆在人群中你肯定不会忘记,0.0,0.8,0.0,0.2,0.0
video_0043,61,我始终觉得哪里有空填哪是最容易出来的,0.2,0.2,0.2,0.0,0.0
video_0043,63,因为我觉得走我也不后悔,0.0,0.8,0.0,-0.4,0.0
video_0043,64,只要够优秀，优秀到极点，那我肯定要抢的,0.0,0.8,0.0,0.2,0.0
video_0044,2,我们要正面侧面还有后面都拍你一下，好吧,0.6,0.0,0.6,0.6,0.0
video_0044,10,为什么不演这个呢,-0.8,-0.4,-0.8,0.0,0.0
video_0045,1,我觉得这是我今天得到的最大的收获,0.4,0.4,0.4,0.0,0.0
video_0045,8,说的好可怜啊,1.0,-1.0,1.0,1.0,0.0
video_0045,16,我心里想，哇我好开心哦，我终于可以换一个地方休息一下了,1.0,1.0,1.0,0.6,0.0
video_0045,18,在文工团里面，我们不仅要表演，我们还要搭舞台，灯光，音响，做道具,0.0,0.0,0.0,0.4,0.0
video_0045,60,至少我觉得米个人都应该真诚都应该认真说话,-0.4,0.6,-0.4,-1.0,0.0
video_0045,59,毕竟我自己就做不到,-0.4,-0.6,-0.4,-0.2,0.0
video_0045,56,你从他身上感受到的最多的是什么,0.0,0.0,0.0,0.0,0.0
video_0045,55,我希望借由这一次的表演，它能够领悟到更多东西,0.0,0.6,0.0,0.0,0.0
video_0045,54,我这么样努力去打工，是为了买一辆自己心爱的摩托车,0.8,0.2,0.8,0.2,0.0
video_0045,47,你最终的这个炮弹要落在什么地方，我其实是稍微有点发散了,0.0,0.0,0.0,0.0,0.0
video_0043,28,03年我一年见了三百多个剧组,0.0,0.0,0.0,0.0,0.0
video_0045,39,自己的三十岁，那一定是才高八斗风度翩翩，张口专业名词，闭嘴绅士微笑,0.8,0.8,0.8,0.4,0.0
video_0045,35,只要不吐我，爱吐谁吐谁,0.4,-0.6,0.4,0.0,0.0
video_0045,34,最开始说好的那样，这不是一场比赛，这是一场秀，加油,0.8,1.0,0.8,1.0,0.0
video_0045,33,三十而立，四十不惑，五十知天命,0.0,0.2,0.0,0.0,0.0
video_0045,25,我爱国，但是我不太会在大场合讲爱国,0.0,0.6,0.0,0.6,0.0
video_0045,24,有一阵子我的眼眶湿润了,0.0,1.0,0.0,0.2,0.0
video_0045,20,原来我以前都不会的事情也不需要做的事情我竟然都会了,0.8,0.6,0.8,0.4,0.0
video_0045,38,你能不能买点正经衣服,-1.0,-1.0,-1.0,-1.0,0.0
video_0043,22,各位老师是可以从一个上帝视角来看我,0.0,0.0,0.0,0.0,0.0
video_0043,20,当然你的傲慢我也很喜欢,1.0,1.0,1.0,0.8,0.0
video_0043,19,这个也是演员的美学，他需要去学习的,0.0,0.0,0.0,0.0,0.0
video_0041,31,我假装约他采访约他去,-1.0,0.0,-1.0,-0.8,0.0
video_0041,30,我说我啊约他上国民饭店,-1.0,0.0,-1.0,-0.8,0.0
video_0041,28,怎么就那么开心呢我,1.0,1.0,1.0,0.6,0.0
video_0041,27,你说我身边要没有他，我这心里头啊,-1.0,-0.6,-1.0,-1.0,0.0
video_0041,26,他跟人家说群的去了,-1.0,0.0,-1.0,-1.0,0.0
video_0041,25,主要是我那搭档，他不是，这前几天呢，他也不跟我说一声,-1.0,0.0,-1.0,-1.0,0.0
video_0041,32,实际上我是想让他教我唱几出戏,-1.0,0.0,-1.0,-0.8,0.0
video_0041,16,你们也被这边感染了吗,0.6,-0.2,0.6,0.0,0.0
video_0041,14,所以我就买通了星期六晚报,-1.0,0.0,-1.0,-1.0,0.0
video_0041,13,我要是当了您的夫人我就不好意思在跟他来往，我怕损害了督办的名声,-1.0,0.0,-1.0,-0.8,0.0
video_0041,12,我当您的媳妇之后呢我还是想唱戏，但是我过去我是想让他教我唱戏,-1.0,0.0,-1.0,-1.0,0.0
video_0041,11,跟您这么说吧，那天其实我在裕德里的时候我就挺喜欢刘汉臣的,-1.0,0.6,-1.0,-1.0,0.0
video_0041,10,那国民饭店是怎么回事,-1.0,0.0,-1.0,-1.0,0.0
video_0041,8,督办您是什么人啊，您是铮铮铁骨，您是男子汉，统带千军万马,-1.0,0.8,-1.0,-0.8,0.0
video_0041,15,我为什么没有对外界说呢，我还是照顾督办的名声,-1.0,0.4,-1.0,-1.0,0.0
video_0045,61,不要把自己当成是奥斯卡影帝，刻意的煽情和无病呻吟都是伪装的真诚,-0.8,-0.8,-0.8,-1.0,0.0
video_0042,1,我让你给咱们保安队招新人招的怎么样了,-0.2,0.0,-0.2,-0.2,0.0
video_0042,4,他不还是上次那个人吗，他怎么又来了,-1.0,-0.4,-1.0,-1.0,0.0
video_0043,18,关于你的表演里面，你有没有站在观众的角度思考这段表演是否过长或是否过于激烈,0.0,-0.4,0.0,0.0,0.0
video_0043,17,你吼我，长这么大你吼过我吗,-1.0,-1.0,-1.0,-1.0,0.0
video_0043,16,抱歉，我当年没做到，所以你做到了我还挺羡慕你的,0.0,1.0,0.0,-0.2,0.0
video_0043,15,喝醉不是你耍无赖的理由,-1.0,-1.0,-1.0,-1.0,0.0
video_0043,8,我举个例子，编剧说你打杯水喝，那么这本来就是个心理反应,0.2,0.0,0.2,0.2,0.0
video_0043,5,即兴练习应该是让一个人的缺点优点暴露无遗的一个考核标准吧,0.0,0.0,0.0,0.0,0.0
video_0042,2,好，那我就放心了，他们人呢,1.0,0.4,1.0,0.6,0.0
video_0043,4,你给他时间准备，他就会透过排练掩盖他本身的缺点,0.0,-0.4,0.0,0.0,0.0
video_0042,20,我的三元得力干将，这次都进化了,-1.0,0.6,-1.0,-0.2,0.0
video_0042,19,和水手们亲切地交谈，他看见我，向我亲切的挥了挥手,1.0,0.8,1.0,0.8,0.0
video_0042,17,很久没人问我这个问题了,-0.4,0.0,-0.4,0.0,0.0
video_0042,10,上一边自己呆着去,-1.0,-1.0,-1.0,-1.0,0.0
video_0042,9,小鸡，对不起你,-1.0,-1.0,-1.0,-1.0,0.0
video_0042,5,你别败坏我东西了,-1.0,-1.0,-1.0,-0.8,0.0
video_0043,2,大家看好了，这是我第一档综艺，也是我最好的一档综艺，赶紧来吧,1.0,1.0,1.0,0.6,0.0
video_0041,7,外面传言我跟刘汉臣这场戏的怎么着怎么着，督办您觉得这能是真的吗,-1.0,0.0,-1.0,-1.0,0.0
video_0045,65,你居然会懂得如何让成就他人,0.0,0.4,0.0,0.0,0.0
video_0045,69,我们是速度与激情的队伍,1.0,1.0,1.0,0.8,0.0
video_0047,9,案发当晚你在哪里,0.0,0.0,0.0,0.0,0.0
video_0047,10,你跟嫌犯认识吗,0.0,0.0,0.0,0.0,0.0
video_0047,12,在我们开始谈话之前，我有必要跟你解释一下香港的法律,0.0,0.0,0.0,-0.2,0.0
video_0047,14,如果你没有什么意见的话，我会是你的代理人,0.0,0.0,0.0,-0.2,0.0
video_0047,16,我希望你能把你知道的一切诚实地告诉我,0.0,0.2,0.0,-0.2,0.0
video_0047,18,万文芳跟你是什么关系,0.0,0.0,0.0,0.0,0.0
video_0047,19,你跟警察也是这么说的吗,0.0,0.0,0.0,0.0,0.0
video_0047,21,万文芳承认了你是他的儿子,0.0,0.0,0.0,0.0,0.0
video_0047,22,所以他决定在演唱会结束那一天向媒体公布你和他的关系,0.0,0.0,0.0,0.0,0.0
video_0047,23,那你为什么要那么做,0.0,-0.2,0.0,-0.2,0.0
video_0047,25,你是说你没有拿刀刺杀万文芳,0.0,0.0,0.0,0.0,0.0
video_0047,28,你后悔了是吧,-1.0,-0.8,-1.0,-1.0,0.0
video_0047,29,你还是不想让别人知道我的存在,-1.0,-0.6,-1.0,-1.0,0.0
video_0047,30,当年你遗弃我，就像是遗弃一条小狗,-1.0,-1.0,-1.0,-1.0,0.0
video_0047,31,你以为我是什么，一件垃圾箱扔就扔吗,-1.0,-1.0,-1.0,-1.0,0.0
video_0047,32,我是人，是你的儿子,-1.0,-0.2,-1.0,-1.0,0.0
video_0047,35,看来有些东西是真的不会变的,0.6,-0.2,0.6,0.6,0.0
video_0047,58,那你的工作岗位是在哪里呢,0.0,0.0,0.0,0.0,0.0
video_0047,57,逻辑上是有可能的,0.0,0.0,0.0,0.0,0.0
video_0047,56,根据腹部刀伤的切入角度和高度，我们判断凶手应该身高一米八左右,0.0,0.0,0.0,0.0,0.0
video_0047,55,因为罗美慧在案发时有不在场的证据,0.0,0.0,0.0,0.0,0.0
video_0047,54,但是因为被告掉进了海里，使衣服血迹很模糊,0.0,0.0,0.0,0.0,0.0
video_0047,53,这把刀是案发现场发现的凶器,0.0,0.0,0.0,0.0,0.0
video_0047,6,改天我送你一张新的,0.0,0.4,0.0,0.0,0.0
video_0047,52,那您怎么能确定，您听到的争吵声就是我当事人的声音呢,0.0,0.0,0.0,0.0,0.0
video_0047,47,喂，你们有没有看过美国警方给我们当年托马斯夫妇的车祸资料啊,-1.0,0.0,-1.0,-0.6,0.0
video_0047,46,他患有严重的幽闭恐惧症,0.0,-0.8,0.0,0.0,0.0
video_0047,45,我请求行使我当事人的沉默权,0.0,0.0,0.0,0.0,0.0
video_0047,43,你也没有问什么嘛,-0.8,-0.2,-0.8,-1.0,0.0
video_0047,39,我们收费都不便宜的,0.0,-0.2,0.0,0.0,0.0
video_0047,38,为什么不要直接，省着浪费你和我的时间,0.0,-0.8,0.0,0.2,0.0
video_0047,50,请问您以前，跟我的当事人交谈过吗,0.0,0.0,0.0,0.0,0.0
video_0047,4,对，您的记忆力很好,0.0,0.8,0.0,0.0,0.0
video_0047,3,不就是她出第一张专辑，天使的守候那一年吗,0.0,0.0,0.0,0.0,0.0
video_0047,2,我听说您是一个很特别的检控官，所以想来拜访您一下,0.4,0.8,0.4,0.0,0.0
video_0045,103,后来发现我这样设定好像也不太对，后来我就不管了,0.0,0.0,0.0,0.0,0.0
video_0045,100,因为在我年轻的时候我就已经设想要三十而立,0.2,0.0,0.2,0.0,0.0
video_0045,97,你能不能别老带着我跟你逛童装,-1.0,-1.0,-1.0,-1.0,0.0
video_0045,96,你快三十多岁的人了,-1.0,0.0,-1.0,-1.0,0.0
video_0045,94,你为什么不看我的内容,-1.0,-1.0,-1.0,-1.0,0.0
video_0045,93,我带不带耳环跟你有什么关系,-1.0,-1.0,-1.0,-1.0,0.0
video_0046,5,那天你昏迷了一天什么都没有做，你能证明我说错了吗,-0.2,-0.2,-0.2,-0.8,0.0
video_0045,92,我说我讲的东西是好的，能够对你有帮助，你为什么不接纳我,-1.0,-0.8,-1.0,-0.8,0.0
video_0045,89,只要我讲的内容对你有帮助就行了,0.2,0.6,0.2,-0.2,0.0
video_0045,87,我内心深处的想法是,0.0,0.0,0.0,-0.2,0.0
video_0045,86,我带耳环给企业做培训，给政府做培训，我做了很多,0.0,0.0,0.0,-0.2,0.0
video_0045,85,我戴耳环戴很久,0.0,0.0,0.0,0.0,0.0
video_0045,76,从认真也好，从人性也好，都挺有火气的，我说这制止，怎么个制止法呢,0.0,-0.2,0.0,0.0,0.0
video_0045,75,你比黄小山要难你知道吗，因为你在小山后面讲,-0.2,0.0,-0.2,-0.2,0.0
video_0045,90,因为当我去给那些比较传统的政府官员，或者年龄比较大的企业主，或者这些教育工作者讲课的时候,0.0,0.0,0.0,0.0,0.0
video_0045,66,每个人都想成全自己，但是很少有人会想到如何通过成全别人来成全自己,0.0,-0.4,0.0,0.2,0.0
video_0046,6,用自己的表格记录一下这些时间是怎么花的,0.0,0.0,0.0,-0.6,0.0
video_0046,21,庙里的和尚都这么说，活该你单身,-1.0,-0.6,-1.0,-0.6,0.0
video_0046,53,你已经知道其实是没有人做过，就是因为没有人做过所以你想去做,0.0,-0.2,0.0,0.2,0.0
video_0046,51,我的极限，我的痛苦可能已经到达一个临界点,0.0,-0.8,0.0,-0.2,0.0
video_0046,46,能够让别人明白命运可以掌握在自己手里面，那我就觉得已经很开心很满足了,0.8,1.0,0.8,0.0,0.0
video_0046,41,我也幻想过自己是一个球员，可以加入NBA和科比一起打球,0.6,0.4,0.6,0.6,0.0
video_0046,40,我小时候曾经幻想过自己是超人，可以出现在人们需要我的时候拯救世界,1.0,0.8,1.0,0.6,0.0
video_0046,38,父母的爱就是我成长中最好的养料,0.2,0.8,0.2,-0.8,0.0
video_0046,13,你所有走过的弯路，艾力，我全部都走过,0.0,0.2,0.0,0.4,0.0
video_0046,34,因为我一直相信我的儿子会回到我的身边，我就是有这样一个信念让我坚守了二十六年,-0.2,1.0,-0.2,-1.0,0.0
video_0046,30,我儿子不是太可怜了吗,-1.0,-1.0,-1.0,-1.0,0.0
video_0046,29,又是这个然而，房东说孩子三天前又被送到安康去了,-1.0,0.0,-1.0,-1.0,0.0
video_0046,28,我说你有孩子你为什么偷我的儿子,-1.0,-1.0,-1.0,-1.0,0.0
video_0046,25,我见着两个观点，重点是想要跟你表达个性好其实是很难的,-0.2,-0.8,-0.2,-0.2,0.0
video_0046,24,不不，别跟我提这个，以为内男人和女人像的东西永远都不同，他永远不会明白你在想什么,-0.6,-0.6,-0.6,-1.0,0.0
video_0046,23,我当时只有一句话，不带着坑媳妇的吧,-1.0,-0.8,-1.0,-1.0,0.0
video_0046,31,算上我加上你一共八个人，不同的年纪不同的性别来自不同的地方做不同的事,-0.2,0.0,-0.2,-0.6,0.0
video_0041,6,你也知道，我原来是妓院出来的，我嫁到督办这呢，我跟了督办了,-1.0,-0.6,-1.0,-0.8,0.0
video_0041,5,急呀，我问你怎么回事,-1.0,-0.8,-1.0,-1.0,0.0
video_0041,3,你哭什么，我问你怎么回事，你跟那场戏似的我问你怎么回事,-1.0,-1.0,-1.0,-1.0,0.0
video_0031,33,惟有解决引起战争的祸首，才能停止这场战争。,0.0,0.2,0.0,-0.4,0.0
video_0032,1,如果有什么不一样的呢，你给我这版为准。,0.6,0.0,0.6,0.6,0.0
video_0032,2,让不让着你，就你干点事儿，该不该打，自己说,-1.0,-1.0,-1.0,-1.0,0.0
video_0032,5,就是这么想的，要活一起活，要死大家一起。,1.0,-0.8,1.0,-0.6,0.0
video_0032,7,吴先生，你就认倒霉吧,-0.4,-0.4,-0.4,-0.8,0.0
video_0032,10,别找抽了你，接着说。,-1.0,-0.6,-1.0,-1.0,0.0
video_0032,12,你要不想说，我也不跟你废话。,-0.4,0.0,-0.4,-0.8,0.0
video_0032,14,洪先生，我是你的粉丝，特别喜欢你的戏，但是我在网上搜过你，你已经结婚了,0.0,0.8,0.0,-0.4,0.0
video_0032,15,我妈也是你的一个大粉丝，他也特别喜欢你的戏。,0.8,1.0,0.8,0.4,0.0
video_0032,19,你不是演过赌神的吗？你这样合适吗？,-1.0,0.4,-1.0,-0.2,0.0
video_0032,23,你值得吗，这是绑架,-0.4,-0.4,-0.4,-1.0,0.0
video_0033,2,我台湾来的嘛，你呢,1.0,0.0,1.0,0.4,0.0
video_0033,3,你不用说，没关系啊，我可以住在这边吗？,0.2,0.2,0.2,0.4,0.0
video_0033,10,等了你很长时间，留下一封信说要交给你。,0.0,0.0,0.0,0.0,0.0
video_0033,12,我怕丢了，我帮你收起来了，我没看过。,-0.2,0.0,-0.2,-0.4,0.0
video_0033,13,你表哥真会做生意啊，刚刚开始介绍我买炸鱼薯条，现在连店都让给我了。,1.0,0.4,1.0,0.8,0.0
video_0034,3,会有人来救我们吧,-1.0,0.4,-1.0,-0.6,0.0
video_0035,32,我可以一辈子活在李白的阴影里，但你不能说我的长恨歌是假的,-1.0,-1.0,-1.0,-1.0,0.0
video_0035,24,我也认识你啊，白居易,0.0,0.0,0.0,0.2,0.0
video_0035,18,整个花萼楼外，牡丹种了十万株,0.8,0.0,0.8,0.6,0.0
video_0035,17,那猫真的会来吗,0.0,0.0,0.0,-0.8,0.0
video_0035,15,降服妖猫还有谁比他更合适呢,1.0,0.4,1.0,1.0,0.0
video_0035,12,当家的惠果大师当年从狮子国取回了秘法，座下有上千僧人,0.8,0.0,0.8,0.8,0.0
video_0031,30,公主请放心，我是北魏的将军花木兰。,0.0,0.2,0.0,-0.2,0.0
video_0035,11,白居易，他可狂得很,1.0,0.0,1.0,1.0,0.0
video_0034,17,明天你休息一下吧,0.2,0.4,0.2,-0.2,0.0
video_0034,16,冰山只会在大海上所以北边是海。,0.0,0.0,0.0,-0.2,0.0
video_0034,10,那个废弃的小站就是这里。,0.0,0.0,0.0,0.0,0.0
video_0034,9,会引发大量的肌肉坏死，我的内脏功能会衰竭，我会死的。,-1.0,-1.0,-1.0,-1.0,0.0
video_0034,6,那这也不行那也不行，怎么办呀，就在这等死啊！,-1.0,-1.0,-1.0,-1.0,0.0
video_0034,5,你别再说这话了行吗，这是哪儿啊，南极。你爬再高，也没有信号。,-1.0,-1.0,-1.0,-0.8,0.0
video_0034,23,无论环境是好是坏,-0.4,0.0,-0.4,-0.2,0.0
video_0031,29,在你的眼里我是吧，所以我们柔然人来说，我是个千古不遇的英雄。,1.0,1.0,1.0,0.4,0.0
video_0031,28,我，大维皇第七皇子，拓跋宏,0.0,0.2,0.0,0.4,0.0
video_0031,27,我们的队伍里，有汉人，士人,0.0,0.0,0.0,0.4,0.0
video_0030,30,典平吹的不如我好，为啥他就能学百鸟朝凤，我不能学,-1.0,-1.0,-1.0,-1.0,0.0
video_0030,28,那你为啥要赶我走？,-1.0,-1.0,-1.0,-1.0,0.0
video_0030,27,师傅，是我吹得不够好吗？,-1.0,-0.6,-1.0,-1.0,0.0
video_0030,23,可咱们这黄河岸上不能没有唢呐,0.2,0.2,0.2,0.0,0.0
video_0030,14,诶，爸，你咋知道嘞,1.0,0.2,1.0,0.6,0.0
video_0030,11,师娘跟我说让我在家呆两天。,-0.2,0.0,-0.2,-0.2,0.0
video_0030,31,师娘，我走了。,-1.0,0.0,-1.0,-0.8,0.0
video_0030,10,你说你呀，真给我丢脸。,-1.0,-1.0,-1.0,-1.0,0.0
video_0030,6,使劲喊哪娃，使劲喊,-1.0,0.4,-1.0,-1.0,0.0
video_0030,5,你个狗日的，这半瓢水你都吸不干净,-1.0,-1.0,-1.0,-1.0,0.0
video_0030,3,你再敢说这话，看老子撕破你的嘴。,-1.0,-1.0,-1.0,-1.0,0.0
video_0030,2,我不想吹唢呐,-1.0,-0.6,-1.0,-1.0,0.0
video_0029,26,我就想活着出去见我老婆孩子。,1.0,0.4,1.0,0.4,0.0
video_0029,25,呜呜呜呜呜呜呜,-1.0,-1.0,-1.0,-1.0,0.0
video_0030,9,啥好好的，好好的师傅能让你回来？,-1.0,-0.8,-1.0,-1.0,0.0
video_0035,33,是皇上下的令，我亲手绣的白绫,0.0,0.0,0.0,-0.2,0.0
video_0030,32,天明说天明说，他游家班出活，跟我屁相干啊！,-1.0,-1.0,-1.0,-0.8,0.0
video_0030,35,要是师傅让我接班，那唢呐班子早没了。,-1.0,-0.6,-1.0,-0.8,0.0
video_0031,22,那也不一定赢啊，我们退吧,-0.4,-0.8,-0.4,-1.0,0.0
video_0031,18,这就是战争。,-1.0,0.0,-1.0,-0.6,0.0
video_0031,16,如果可以用我的生命去停止这场战争的话，我早就做了。,-1.0,-0.2,-1.0,-1.0,0.0
video_0031,15,谁想打仗？我也不想再打仗了。,-1.0,-0.2,-1.0,-1.0,0.0
video_0031,14,大家正等着将军出战呢,0.0,0.0,0.0,-0.2,0.0
video_0031,10,女儿想做魏国的皇后。,1.0,0.6,1.0,0.8,0.0
video_0030,34,这是我师爷的师爷的师爷传给我的，二三百年了,1.0,0.0,1.0,0.8,0.0
video_0031,8,但是我现在明白，他是在磨练我,0.4,0.0,0.4,-0.2,0.0
video_0031,6,你要打，就在战场上打,-1.0,0.0,-1.0,-0.8,0.0
video_0031,3,有一天你发现天上多了一颗星星，那就是我找你娘去了,-0.4,0.0,-0.4,-0.6,0.0
video_0031,2,门图，你不要再杀战俘了,-0.2,-0.8,-0.2,-0.8,0.0
video_0030,38,你别叫师傅，我没你这个徒弟。,-1.0,-0.8,-1.0,-1.0,0.0
video_0030,37,尤天明，你个小狗日的，给老子出来。,-1.0,-1.0,-1.0,-1.0,0.0
video_0030,36,就关我的事儿，你想干啥,-1.0,-0.6,-1.0,-1.0,0.0
video_0031,7,我求你了，求你保守住我的秘密不要让别人知道,-1.0,-0.8,-1.0,-0.8,0.0
video_0035,35,陈玄礼是陈云樵的爹，马嵬驿兵变的主谋,0.0,0.0,0.0,0.2,0.0
video_0036,1,昨天的事你怎么今天才来禀报啊,-1.0,-1.0,-1.0,-1.0,0.0
video_0036,2,我拿你当心腹，你不能老放马后炮啊,-1.0,-1.0,-1.0,-1.0,0.0
video_0039,6,没开几天车，就觉得自己车机已经了不得了,-1.0,-0.4,-1.0,-1.0,0.0
video_0039,4,夏军，你放开我老婆,-1.0,-0.6,-1.0,-1.0,0.0
video_0038,48,你带我来公司干嘛,-1.0,-0.2,-1.0,-1.0,0.0
video_0038,47,这是她第一次约我，你快帮我想想办法呀,-1.0,0.4,-1.0,-1.0,0.0
video_0038,44,我吃过了,0.0,0.0,0.0,-0.2,0.0
video_0038,42,那还那么乱呢，打扫干净再走,-1.0,-1.0,-1.0,-0.8,0.0
video_0040,2,我们私下谈不行吗,-1.0,-0.2,-1.0,-1.0,0.0
video_0038,41,是不是特别想唱给我听呀,1.0,0.6,1.0,0.8,0.0
video_0038,26,少拍马屁，说实话,-1.0,-1.0,-1.0,-1.0,0.0
video_0038,22,我出去挣钱，还不都是为了你,-1.0,-0.8,-1.0,-1.0,0.0
video_0038,21,他不是没有钱的时候是绝对不会回来的,-1.0,-0.4,-1.0,-1.0,0.0
video_0038,20,所以我是我们台里的资深表演艺术家,1.0,0.2,1.0,1.0,0.0
video_0038,13,帮我拒了吧，就说我没时间,0.0,-0.4,0.0,0.0,0.0
video_0038,10,过去这么多年的事，谁要在乎啊,-1.0,-1.0,-1.0,-1.0,0.0
video_0038,39,这你也能认出来,0.0,-0.2,0.0,0.0,0.0
video_0038,9,宝贝，相信我，他在等你,1.0,1.0,1.0,1.0,0.0
video_0040,6,自信是美国文化对个人最基本的要求,0.0,0.4,0.0,0.0,0.0
video_0040,11,在读书呢，嚷嚷什么啊,-1.0,-1.0,-1.0,-1.0,0.0
video_0040,47,晓骏，这个事情吧，咱们得暂时缓一缓,0.0,0.0,0.0,0.0,0.0
video_0040,42,因为他们从一开始就失败了,-0.6,-0.4,-0.6,-0.6,0.0
video_0040,39,这就是现实,-1.0,0.0,-1.0,-1.0,0.0
video_0040,33,关你屁事，你以为你也能指导我吗,-1.0,-1.0,-1.0,-1.0,0.0
video_0040,31,我为什么要移民啊，给我移我也不会,-1.0,-0.4,-1.0,-1.0,0.0
video_0040,29,她伤害了我，到美国才一个月就提出和我分手,-1.0,-0.8,-1.0,-0.6,0.0
video_0040,7,我根本就没有自信，我害怕被拒,-1.0,-0.8,-1.0,-0.8,0.0
video_0040,27,好，很不错,1.0,1.0,1.0,1.0,0.0
video_0040,23,我真的是孙子,-0.6,-1.0,-0.6,0.0,0.0
video_0040,21,它认识我我不认识它,-0.4,0.0,-0.4,-0.2,0.0
video_0040,20,如果你们实在不喜欢听我讲课你们可以走,-1.0,-0.8,-1.0,-1.0,0.0
video_0040,19,你们可不可以不要在课堂上睡觉,-1.0,-1.0,-1.0,-1.0,0.0
video_0040,14,听见没有，我叫你滚,-1.0,-1.0,-1.0,-0.2,0.0
video_0040,12,关你屁事,-1.0,-1.0,-1.0,-0.4,0.0
video_0040,24,如果只看长相，那叫好色,0.0,0.0,0.0,0.0,0.0
video_0047,62,那雪花是你写的吗,0.0,0.0,0.0,0.0,0.0
video_0038,8,做朋友这方面，乔一真的没话说,1.0,1.0,1.0,0.8,0.0
video_0038,4,假设，女主人公在学生时代非常的自卑,0.0,-0.6,0.0,0.2,0.0
video_0036,30,都督答应放我走的,-1.0,0.0,-1.0,-1.0,0.0
video_0036,27,今夜，是你在这里的最后一晚了,-1.0,-0.2,-1.0,-1.0,0.0
video_0036,26,为什么，你一直都如此服从，愿意做这件事情,-1.0,-0.2,-1.0,-0.6,0.0
video_0036,24,那什么是真的，你说什么是真的,-1.0,-0.2,-1.0,-1.0,0.0
video_0036,22,以前我是你的都督，以后我还是你的都督，如此而已,0.0,0.2,0.0,-0.2,0.0
video_0036,20,田战这是要反啊,-1.0,-1.0,-1.0,-1.0,0.0
video_0036,32,而子虞，要建功立业青史留名，我也要成全他,-1.0,0.8,-1.0,-0.2,0.0
video_0036,19,我不嫁，要去你去,-1.0,-1.0,-1.0,-1.0,0.0
video_0036,11,王子与庶民同罪,-1.0,-0.2,-1.0,-1.0,0.0
video_0036,10,你是不是还要替我当这个王,-1.0,-1.0,-1.0,-1.0,0.0
video_0036,9,我宁可永不收回靖州，也不愿坏了联盟,-1.0,-0.8,-1.0,-1.0,0.0
video_0036,8,你到底有几成胜算,-1.0,0.0,-1.0,-0.6,0.0
video_0036,7,两国是联盟，双方主帅一旦动手等于宣战，这点道理你也不懂,-1.0,-1.0,-1.0,-0.8,0.0
video_0060,36,我跟你没什么好说的，麻烦你把手放开,0.0,-1.0,0.0,-0.2,0.0
video_0036,16,放肆，竟敢公然抗命,-1.0,-1.0,-1.0,-1.0,0.0
video_0038,7,那时候她每天都会帮我带早餐,0.8,0.2,0.8,0.6,0.0
video_0037,2,这个就是你送的蟠桃,-1.0,0.0,-1.0,-1.0,0.0
video_0037,6,滚开,-1.0,-1.0,-1.0,-0.2,0.0
video_0038,2,我俩是高中同学，不过我俩没早恋,0.0,0.0,0.0,0.2,0.0
video_0037,25,你为什么总是要跟我作对,-1.0,-1.0,-1.0,-1.0,0.0
video_0037,22,我说了你也不明白,-1.0,-0.6,-1.0,-1.0,0.0
video_0037,20,凭什么，嗯？,-1.0,-1.0,-1.0,-1.0,0.0
video_0037,19,我不会让你活着回去,-1.0,-0.8,-1.0,-0.8,0.0
video_0037,18,想要你就说嘛，打晕我干什么啊,-1.0,-1.0,-1.0,-1.0,0.0
video_0037,3,不准打男人,-1.0,-0.2,-1.0,-1.0,0.0
video_0037,17,当真以为我打不过你,-1.0,-0.4,-1.0,-0.6,0.0
video_0037,13,为什么要毁掉那么多美丽的地方，我不明白，我不服,-1.0,-1.0,-1.0,-1.0,0.0
video_0037,12,女人小孩我都不会放过,-1.0,-0.6,-1.0,-0.6,0.0
video_0037,11,我不要当你的手下，你以为这个东西可以控制我啊，太小看我,-1.0,-1.0,-1.0,-0.6,0.0
video_0037,10,来，给我,0.8,0.0,0.8,0.2,0.0
video_0037,9,这个奖不是属于我的，是属于大家的,1.0,0.6,1.0,0.6,0.0
video_0037,8,简单来说，你就是个杂种,-1.0,-1.0,-1.0,-0.6,0.0
video_0037,15,把你也连累了,-1.0,0.0,-1.0,-0.4,0.0
video_0047,63,但是那句话真的不是我写的,-1.0,-0.2,-1.0,-0.8,0.0
video_0047,68,我有一件事情，一直不知道该不该跟你说,-0.2,0.0,-0.2,-0.2,0.0
video_0047,69,为了今天的成就和地位，她已经付出了太多了,-0.6,-0.6,-0.6,-0.8,0.0
video_0055,15,没想到心眼那么小，破别人财,-1.0,-0.8,-1.0,-1.0,0.0
video_0055,18,可以呀朋友,1.0,1.0,1.0,0.8,0.0
video_0055,19,那必须的，我们学校是去年耐克杯亚军呢,1.0,1.0,1.0,1.0,0.0
video_0055,20,早晚有一天诺基亚得统治全世界,0.6,0.6,0.6,0.6,0.0
video_0055,23,人呢，就是应该愿赌服输，对吧,1.0,0.2,1.0,0.6,0.0
video_0055,24,你们给我等着，你们一定给我等着,-1.0,-1.0,-1.0,-1.0,0.0
video_0055,25,你不起吃包子吗，我以后天天给你送包子,1.0,0.4,1.0,1.0,0.0
video_0055,30,你不也忙吗，你不也得过你的日子吗,-0.8,-0.8,-0.8,-0.8,0.0
video_0055,31,您是大学生，我是进去过的人,-0.8,-0.8,-0.8,-0.8,0.0
video_0055,32,你俩就别打了,-1.0,-0.8,-1.0,-1.0,0.0
video_0055,34,你出来也应该跟我们说一声,-1.0,-0.2,-1.0,-1.0,0.0
video_0056,6,我说过我会带她去的，你为什么不看好他,-1.0,-1.0,-1.0,-1.0,0.0
video_0056,7,你已经推了七次了，他一直都在等你你知道吗,-0.8,-1.0,-0.8,-1.0,0.0
video_0056,10,呦，徐总这是干嘛呢,1.0,-0.2,1.0,1.0,0.0
video_0056,11,放开,-1.0,-0.8,-1.0,-1.0,0.0
video_0056,12,你刚才不是说你要去泰国吗,-0.6,0.0,-0.6,-0.6,0.0
video_0056,13,我再说一遍，我只要小迪,-0.6,-0.2,-0.6,-0.6,0.0
video_0056,37,我会还你钱的,-1.0,0.2,-1.0,-1.0,0.0
video_0056,36,spa，大哥你看，spa,1.0,0.2,1.0,1.0,0.0
video_0056,33,你咋知道呢,1.0,0.0,1.0,1.0,0.0
video_0056,30,我妈说了，得饶人处且饶人,1.0,-0.2,1.0,1.0,0.0
video_0056,27,找不到了吧,1.0,-0.6,1.0,1.0,0.0
