video_id,clip_id,text,label,label_t,label_v,label_a,error
video_0009,6,我今天赢回了这么多金瓜子，你怎么不高兴啊？,1.0,-0.8,1.0,0.6,1.8
video_0015,23,你不是很上镜,1.0,-0.8,1.0,0.6,1.8
video_0010,24,真的，你看你这个流氓样子。,0.6,-1.0,1.0,0.2,1.6
video_0014,29,从今天起，你妈就是我妈,-1.0,0.6,-1.0,0.0,1.6
video_0014,31,这样就可以多维持几个月,-1.0,0.6,-1.0,-0.6,1.6
video_0015,31,这种桥段，在我们侦探推理届并不新鲜。,1.0,-0.6,1.0,0.6,1.6
video_0015,8,都是道上的，给点面子啦,-0.6,0.8,-1.0,0.0,1.4
video_0013,4,老规矩，就是脱衣服。,1.0,-0.4,0.8,0.6,1.4
video_0001,31,不是都快破产了吗,0.6,-0.8,1.0,-0.8,1.4
video_0002,23,非常理解您想请朋友们把酒言欢的心情。,-0.6,0.8,-1.0,-0.2,1.4
video_0013,32,我喜欢那个曾经聪颖独立，潇洒自如的你,-0.2,1.0,-0.8,-0.4,1.2
video_0013,23,啊，就是因为你这个棋谱，完，一夜回到解放前了。,0.2,-1.0,1.0,0.2,1.2
video_0015,25,可以去澳洲啊，那边阳光好，海鲜也很棒啊！,-0.2,1.0,-1.0,0.6,1.2
video_0012,47,如果皇上宠幸你的话，你求个情不就行了吗？,-0.6,0.6,-1.0,-1.0,1.2
video_0013,24,这个是送你的礼物。,1.0,0.0,1.0,0.6,1.0
video_0006,4,"现在是关键时刻，大家要团结嘛,啊！",0.0,1.0,-1.0,-0.2,1.0
video_0008,8,照顾我生意啊,1.0,0.0,1.0,-0.2,1.0
video_0013,22,喂，娟儿，我收工了,1.0,0.0,1.0,0.6,1.0
video_0001,19,我说就算你给我一个亿我都不乐意，我就想在大渣集团干到断气,-1.0,0.0,-1.0,-1.0,1.0
video_0008,6,要不这样吧，让给我们家做年夜饭的酒店给你们送。,1.0,0.0,1.0,0.4,1.0
video_0008,4,今天我想当面跟你说。,0.6,-0.4,0.8,0.0,1.0
video_0013,33,我在年轻的时候有一个男孩子他很爱很爱我。,-0.2,0.8,-1.0,-1.0,1.0
video_0014,25,我们也只是听说，万一。,-1.0,0.0,-1.0,-0.4,1.0
video_0013,35,你这偷懒的方法太低级了,0.2,-0.8,1.0,0.4,1.0
video_0005,11,活了74岁了。,-1.0,0.0,-1.0,-1.0,1.0
video_0002,30,王先生，你忘了我刚跟你说半年的事。,-1.0,0.0,-1.0,-0.6,1.0
video_0015,6,你想要什么我都给你啊！,-0.6,0.4,-1.0,-0.6,1.0
video_0002,19,你那点财务还需要助理,0.2,-0.8,1.0,-0.6,1.0
video_0015,10,你把箱子放哪了？,-1.0,0.0,-1.0,-1.0,1.0
video_0016,3,我是梦特，我现在叫孟特娇,1.0,0.0,1.0,1.0,1.0
video_0016,17,你们说夏洛什么时候能找她呀？,-1.0,0.0,-1.0,-0.2,1.0
video_0016,27,早就不练了，有一年比赛，我把标枪扎，裁判身上了，后来就被终身禁赛了。,0.4,-0.6,1.0,0.2,1.0
video_0014,13,你同伴告诉我的。,0.8,0.0,1.0,0.0,0.8
video_0009,33,儿臣理应为朝政、为父皇分忧。,0.8,0.0,1.0,0.0,0.8
video_0016,8,行吧，喝点酒有时有晌的，赶紧,0.0,-0.8,0.0,-1.0,0.8
video_0016,25,差钱的话，你告诉我个数，我回去凑还不行吗？,0.0,-0.8,-0.4,-0.6,0.8
video_0011,3,是正事，华妃失势难免不会东山再起。,0.2,-0.6,0.6,-0.2,0.8
video_0001,13,有人假扮我，我要把事情弄清楚。,0.0,-0.8,0.6,-0.2,0.8
video_0016,28,怎么，吃不惯啊,0.0,-0.8,1.0,-0.8,0.8
video_0007,2,还记得今天是什么日子吗？,-0.8,0.0,-1.0,-0.2,0.8
video_0001,27,但是您现在可以卖身救集团，干还是不干是吧？,0.0,-0.8,0.0,-0.4,0.8
video_0005,15,所有的证据证人全是对的,-0.2,0.6,-1.0,-0.6,0.8
video_0002,5,你们就一个球都别想进,0.0,-0.8,-0.8,-0.6,0.8
video_0008,11,花多少钱我都可以的啦。,-0.2,0.6,0.2,0.4,0.8
video_0001,24,这样吧，你自己说说，咱们集团什么职位比较轻松啊！,-0.4,0.4,-0.2,0.2,0.8
video_0001,30,大渣集团的小职员？,0.2,-0.4,1.0,-0.6,0.6000000000000001
video_0012,14,王后娘娘一人之下，还缺什么呢,-0.2,0.4,-0.2,-0.8,0.6000000000000001
video_0014,24,别担心，我替你们去,-0.2,0.4,-0.6,0.0,0.6000000000000001
video_0002,27,我工作以来从来没有算错过任何一笔账，我不会因为你而破例,0.2,-0.4,-0.6,-0.2,0.6000000000000001
video_0012,28,我们现在有孩子了，不能再像以前那样得过且过。,-0.2,0.4,0.2,-0.4,0.6000000000000001
video_0015,41,恶人是不是该这么笑，哈哈哈,0.2,-0.4,1.0,0.6,0.6000000000000001
video_0012,19,到时候代王的伤痛也许就过去了。,0.4,-0.2,-0.8,0.2,0.6000000000000001
video_0009,2,妹妹不敢有任何非分之想。,-0.4,0.2,0.0,0.2,0.6000000000000001
video_0011,28,一去不知何时才能回来，要不先到偏殿等候吧。,0.2,-0.4,1.0,0.0,0.6000000000000001
video_0011,20,身为皇后，永远都不能有说厌烦的时候。,-0.4,0.2,-0.8,-0.2,0.6000000000000001
video_0002,20,你放心，你的猪脑我另作他用。,0.2,-0.4,0.2,0.6,0.6000000000000001
video_0015,22,你怎么又是一个人在家？,0.0,-0.6,0.0,-0.2,0.6
video_0015,1,据我推测应该是送她的同伙杀人越货。,0.0,-0.6,-0.2,-0.6,0.6
video_0001,25,我们想找你聊聊。,-0.6,0.0,-0.4,-0.2,0.6
video_0015,40,当然，这些都是假设，也没有证据可以证明一个死人的性取向。,0.0,-0.6,0.0,0.0,0.6
video_0005,5,如果没有不同意的，我们现在就开始啊,0.0,0.6,0.0,0.0,0.6
video_0014,2,还差个300多，你们家那房写的谁的名？,-0.6,0.0,-0.2,0.2,0.6
video_0013,34,你乖乖把这些吃了，你想知道什么我都会告诉你。,0.0,0.6,0.2,0.4,0.6
video_0011,33,天气炎热，公主吃不下，难免瘦了些。,0.0,-0.6,0.8,0.4,0.6
video_0012,25,你没有想到，本侯爷也有今天吧,-0.6,0.0,-0.8,0.2,0.6
video_0010,10,这不是早上起来头脑清楚嘛，我就跑了个步，再做个听力。,0.0,0.6,0.2,0.4,0.6
video_0010,11,年轻的时候，我就是想先把业立起来，踏踏实实地为老百姓做点事。,0.0,0.6,-1.0,0.0,0.6
video_0009,27,该用张参来离间高相和皇后,0.0,-0.6,0.0,0.0,0.6
video_0010,29,亲爱的，怎么跟外星人似的,0.6,0.0,1.0,0.8,0.6
video_0012,3,带弟弟去午睡，母后要做事了,0.6,0.0,1.0,0.4,0.6
video_0003,1,当然，也不能说是百分之百,-0.4,0.0,0.8,0.0,0.4
video_0002,2,这菜还没凉，要不吃点？,0.0,0.4,0.4,0.0,0.4
video_0009,21,没有，我就穿上这身衣服试试。,0.4,0.0,1.0,0.6,0.4
video_0002,3,你说的那些都是我的业余爱好,0.0,0.4,-0.6,0.6,0.4
video_0011,30,想必是与皇后反其道而行之，想让皇上从严处置安比槐吧,0.0,-0.4,0.0,0.0,0.4
video_0009,16,我不是担心你嘛，就过来看看。,0.0,0.4,-0.2,0.4,0.4
video_0002,17,如果放弃选择的话，那这三百亿怎么处置？,0.0,-0.4,-0.2,0.0,0.4
video_0002,25,我看你跟王老板关系那么好，他没赏你个啥挣钱的职位？,-0.2,0.2,-0.6,0.2,0.4
video_0012,31,转眼间，我已经变成太后娘娘了,0.4,0.0,0.8,0.0,0.4
video_0013,21,我很好奇，你到底喜不喜欢建筑,-0.4,0.0,-1.0,0.0,0.4
video_0013,16,好大的一碗心灵鸡汤。,-0.2,0.2,-1.0,0.2,0.4
video_0012,38,你可别告诉我你不喜欢美女。,0.0,-0.4,1.0,0.0,0.4
video_0013,13,还没有呢。,-0.4,0.0,-0.6,-0.4,0.4
video_0009,13,不论发现什么，我们都要装作不知道。,0.0,-0.4,0.0,0.0,0.4
video_0009,11,别跟永娘说，我问了话，下去吧。,0.0,-0.4,0.0,0.0,0.4
video_0014,10,要不是你带着我，我估计早就被人骗进小黑屋了，我命就交给你了。,0.0,-0.4,-0.2,-0.2,0.4
video_0013,3,怕你啊，喝就喝,-0.2,0.2,-1.0,-1.0,0.4
video_0014,27,最少能卖150万美金，如果抗到最后，价格没准还能更高,0.0,0.2,-0.8,-0.8,0.2
video_0011,26,怎么，贵人您是为了安答应的父亲求情来了。,-0.2,0.0,-1.0,-0.2,0.2
video_0008,7,回家看电视去了。,0.2,0.0,0.4,0.2,0.2
video_0009,42,我只会唱这一首。,-0.2,0.0,-0.2,-0.8,0.2
video_0015,28,我想我完成一次完美的犯罪。,0.0,-0.2,0.0,0.2,0.2
video_0013,1,哎，我走的时候落了一本书，你看到没啊？,0.0,-0.2,0.0,0.0,0.2
video_0005,2,不是，我是真觉得咱们应该讨论讨论,0.0,-0.2,0.6,0.0,0.2
video_0002,15,王多鱼，我是你二爷。,-0.2,0.0,-1.0,-0.8,0.2
video_0014,11,我在大量搜集某一种牌型的时候也非常在意其他牌型的数量,-0.2,0.0,-0.8,-0.2,0.2
video_0015,18,他是我隔壁班同学，好久都没有去学校了。,-0.2,0.0,0.6,0.0,0.2
video_0014,19,拿石头去比，最差也是平局,-0.2,0.0,-0.6,-0.2,0.2
video_0009,5,已经安排他进了高家的赌场。,-0.2,0.0,0.0,-0.2,0.2
video_0009,30,那妾身现在就召人准备茶,0.2,0.0,1.0,0.4,0.2
